{
  "$schema": "https://json-schema.org/draft/2020-12/schema",
  "$defs": {
    "DeliveryPlanVersion": {
      "additionalProperties": false,
      "properties": {
        "plan_version_id": {
          "pattern": "^[0-9a-f]{8}-[0-9a-f]{4}-[0-9a-f]{4}-[0-9a-f]{4}-[0-9a-f]{12}$",
          "title": "Plan Version Id",
          "type": "string"
        },
        "replenishment_order_id": {
          "pattern": "^[0-9a-f]{8}-[0-9a-f]{4}-[0-9a-f]{4}-[0-9a-f]{4}-[0-9a-f]{12}$",
          "title": "Replenishment Order Id",
          "type": "string"
        },
        "version": {
          "exclusiveMinimum": 0,
          "title": "Version",
          "type": "integer"
        },
        "expected_delivery_at": {
          "pattern": "^\\d{4}-\\d{2}-\\d{2}T\\d{2}:\\d{2}:\\d{2}(?:\\.\\d{1,6})?(?:Z|\\+00:00)$",
          "title": "Expected Delivery At",
          "type": "string"
        },
        "known_at": {
          "pattern": "^\\d{4}-\\d{2}-\\d{2}T\\d{2}:\\d{2}:\\d{2}(?:\\.\\d{1,6})?(?:Z|\\+00:00)$",
          "title": "Known At",
          "type": "string"
        },
        "ingested_at": {
          "pattern": "^\\d{4}-\\d{2}-\\d{2}T\\d{2}:\\d{2}:\\d{2}(?:\\.\\d{1,6})?(?:Z|\\+00:00)$",
          "title": "Ingested At",
          "type": "string"
        },
        "available_at": {
          "pattern": "^\\d{4}-\\d{2}-\\d{2}T\\d{2}:\\d{2}:\\d{2}(?:\\.\\d{1,6})?(?:Z|\\+00:00)$",
          "title": "Available At",
          "type": "string"
        },
        "source_reference": {
          "minLength": 1,
          "pattern": "\\S",
          "title": "Source Reference",
          "type": "string"
        }
      },
      "required": [
        "plan_version_id",
        "replenishment_order_id",
        "version",
        "expected_delivery_at",
        "known_at",
        "ingested_at",
        "available_at",
        "source_reference"
      ],
      "title": "DeliveryPlanVersion",
      "type": "object"
    },
    "Product": {
      "additionalProperties": false,
      "properties": {
        "id": {
          "pattern": "^[0-9a-f]{8}-[0-9a-f]{4}-[0-9a-f]{4}-[0-9a-f]{4}-[0-9a-f]{12}$",
          "title": "Id",
          "type": "string"
        },
        "unit_of_measure": {
          "pattern": "^[a-z][a-z0-9_]*$",
          "title": "Unit Of Measure",
          "type": "string"
        }
      },
      "required": [
        "id",
        "unit_of_measure"
      ],
      "title": "Product",
      "type": "object"
    },
    "ProductSupplier": {
      "additionalProperties": false,
      "properties": {
        "product_supplier_id": {
          "pattern": "^[0-9a-f]{8}-[0-9a-f]{4}-[0-9a-f]{4}-[0-9a-f]{4}-[0-9a-f]{12}$",
          "title": "Product Supplier Id",
          "type": "string"
        },
        "product_id": {
          "pattern": "^[0-9a-f]{8}-[0-9a-f]{4}-[0-9a-f]{4}-[0-9a-f]{4}-[0-9a-f]{12}$",
          "title": "Product Id",
          "type": "string"
        },
        "supplier_id": {
          "pattern": "^[0-9a-f]{8}-[0-9a-f]{4}-[0-9a-f]{4}-[0-9a-f]{4}-[0-9a-f]{12}$",
          "title": "Supplier Id",
          "type": "string"
        },
        "unit_of_measure": {
          "pattern": "^[a-z][a-z0-9_]*$",
          "title": "Unit Of Measure",
          "type": "string"
        },
        "unit_cost": {
          "pattern": "^(?:0|[1-9][0-9]*)\\.[0-9]{2}$",
          "title": "Unit Cost",
          "type": "string"
        },
        "currency": {
          "enum": [
            "PLN",
            "EUR"
          ],
          "title": "Currency",
          "type": "string"
        },
        "priority": {
          "exclusiveMinimum": 0,
          "title": "Priority",
          "type": "integer"
        },
        "effective_from": {
          "pattern": "^\\d{4}-\\d{2}-\\d{2}$",
          "title": "Effective From",
          "type": "string"
        },
        "effective_to": {
          "pattern": "^\\d{4}-\\d{2}-\\d{2}$",
          "title": "Effective To",
          "type": "string"
        },
        "quoted_lead_time_days": {
          "minimum": 0,
          "title": "Quoted Lead Time Days",
          "type": "integer"
        },
        "lead_time_basis": {
          "const": "supplier_quote",
          "title": "Lead Time Basis",
          "type": "string"
        },
        "quote_reference": {
          "minLength": 1,
          "pattern": "\\S",
          "title": "Quote Reference",
          "type": "string"
        },
        "known_at": {
          "pattern": "^\\d{4}-\\d{2}-\\d{2}T\\d{2}:\\d{2}:\\d{2}(?:\\.\\d{1,6})?(?:Z|\\+00:00)$",
          "title": "Known At",
          "type": "string"
        },
        "ingested_at": {
          "pattern": "^\\d{4}-\\d{2}-\\d{2}T\\d{2}:\\d{2}:\\d{2}(?:\\.\\d{1,6})?(?:Z|\\+00:00)$",
          "title": "Ingested At",
          "type": "string"
        },
        "available_at": {
          "pattern": "^\\d{4}-\\d{2}-\\d{2}T\\d{2}:\\d{2}:\\d{2}(?:\\.\\d{1,6})?(?:Z|\\+00:00)$",
          "title": "Available At",
          "type": "string"
        }
      },
      "required": [
        "product_supplier_id",
        "product_id",
        "supplier_id",
        "unit_of_measure",
        "unit_cost",
        "currency",
        "priority",
        "effective_from",
        "effective_to",
        "quoted_lead_time_days",
        "lead_time_basis",
        "quote_reference",
        "known_at",
        "ingested_at",
        "available_at"
      ],
      "title": "ProductSupplier",
      "type": "object"
    },
    "ReplenishmentOrder": {
      "additionalProperties": false,
      "properties": {
        "replenishment_order_id": {
          "pattern": "^[0-9a-f]{8}-[0-9a-f]{4}-[0-9a-f]{4}-[0-9a-f]{4}-[0-9a-f]{12}$",
          "title": "Replenishment Order Id",
          "type": "string"
        },
        "product_supplier_id": {
          "pattern": "^[0-9a-f]{8}-[0-9a-f]{4}-[0-9a-f]{4}-[0-9a-f]{4}-[0-9a-f]{12}$",
          "title": "Product Supplier Id",
          "type": "string"
        },
        "product_id": {
          "pattern": "^[0-9a-f]{8}-[0-9a-f]{4}-[0-9a-f]{4}-[0-9a-f]{4}-[0-9a-f]{12}$",
          "title": "Product Id",
          "type": "string"
        },
        "supplier_id": {
          "pattern": "^[0-9a-f]{8}-[0-9a-f]{4}-[0-9a-f]{4}-[0-9a-f]{4}-[0-9a-f]{12}$",
          "title": "Supplier Id",
          "type": "string"
        },
        "stock_location_id": {
          "pattern": "^[0-9a-f]{8}-[0-9a-f]{4}-[0-9a-f]{4}-[0-9a-f]{4}-[0-9a-f]{12}$",
          "title": "Stock Location Id",
          "type": "string"
        },
        "ordered_quantity": {
          "exclusiveMinimum": 0,
          "title": "Ordered Quantity",
          "type": "integer"
        },
        "unit_of_measure": {
          "pattern": "^[a-z][a-z0-9_]*$",
          "title": "Unit Of Measure",
          "type": "string"
        },
        "ordered_at": {
          "pattern": "^\\d{4}-\\d{2}-\\d{2}T\\d{2}:\\d{2}:\\d{2}(?:\\.\\d{1,6})?(?:Z|\\+00:00)$",
          "title": "Ordered At",
          "type": "string"
        },
        "expected_delivery_at": {
          "pattern": "^\\d{4}-\\d{2}-\\d{2}T\\d{2}:\\d{2}:\\d{2}(?:\\.\\d{1,6})?(?:Z|\\+00:00)$",
          "title": "Expected Delivery At",
          "type": "string"
        },
        "ingested_at": {
          "pattern": "^\\d{4}-\\d{2}-\\d{2}T\\d{2}:\\d{2}:\\d{2}(?:\\.\\d{1,6})?(?:Z|\\+00:00)$",
          "title": "Ingested At",
          "type": "string"
        },
        "available_at": {
          "pattern": "^\\d{4}-\\d{2}-\\d{2}T\\d{2}:\\d{2}:\\d{2}(?:\\.\\d{1,6})?(?:Z|\\+00:00)$",
          "title": "Available At",
          "type": "string"
        },
        "status": {
          "const": "ordered",
          "title": "Status",
          "type": "string"
        },
        "source_reference": {
          "minLength": 1,
          "pattern": "\\S",
          "title": "Source Reference",
          "type": "string"
        }
      },
      "required": [
        "replenishment_order_id",
        "product_supplier_id",
        "product_id",
        "supplier_id",
        "stock_location_id",
        "ordered_quantity",
        "unit_of_measure",
        "ordered_at",
        "expected_delivery_at",
        "ingested_at",
        "available_at",
        "status",
        "source_reference"
      ],
      "title": "ReplenishmentOrder",
      "type": "object"
    },
    "ReplenishmentReceipt": {
      "additionalProperties": false,
      "properties": {
        "receipt_id": {
          "pattern": "^[0-9a-f]{8}-[0-9a-f]{4}-[0-9a-f]{4}-[0-9a-f]{4}-[0-9a-f]{12}$",
          "title": "Receipt Id",
          "type": "string"
        },
        "replenishment_order_id": {
          "pattern": "^[0-9a-f]{8}-[0-9a-f]{4}-[0-9a-f]{4}-[0-9a-f]{4}-[0-9a-f]{12}$",
          "title": "Replenishment Order Id",
          "type": "string"
        },
        "product_id": {
          "pattern": "^[0-9a-f]{8}-[0-9a-f]{4}-[0-9a-f]{4}-[0-9a-f]{4}-[0-9a-f]{12}$",
          "title": "Product Id",
          "type": "string"
        },
        "supplier_id": {
          "pattern": "^[0-9a-f]{8}-[0-9a-f]{4}-[0-9a-f]{4}-[0-9a-f]{4}-[0-9a-f]{12}$",
          "title": "Supplier Id",
          "type": "string"
        },
        "stock_location_id": {
          "pattern": "^[0-9a-f]{8}-[0-9a-f]{4}-[0-9a-f]{4}-[0-9a-f]{4}-[0-9a-f]{12}$",
          "title": "Stock Location Id",
          "type": "string"
        },
        "received_quantity": {
          "exclusiveMinimum": 0,
          "title": "Received Quantity",
          "type": "integer"
        },
        "unit_of_measure": {
          "pattern": "^[a-z][a-z0-9_]*$",
          "title": "Unit Of Measure",
          "type": "string"
        },
        "received_at": {
          "pattern": "^\\d{4}-\\d{2}-\\d{2}T\\d{2}:\\d{2}:\\d{2}(?:\\.\\d{1,6})?(?:Z|\\+00:00)$",
          "title": "Received At",
          "type": "string"
        },
        "ingested_at": {
          "pattern": "^\\d{4}-\\d{2}-\\d{2}T\\d{2}:\\d{2}:\\d{2}(?:\\.\\d{1,6})?(?:Z|\\+00:00)$",
          "title": "Ingested At",
          "type": "string"
        },
        "available_at": {
          "pattern": "^\\d{4}-\\d{2}-\\d{2}T\\d{2}:\\d{2}:\\d{2}(?:\\.\\d{1,6})?(?:Z|\\+00:00)$",
          "title": "Available At",
          "type": "string"
        },
        "sequence": {
          "minimum": 0,
          "title": "Sequence",
          "type": "integer"
        },
        "source_reference": {
          "minLength": 1,
          "pattern": "\\S",
          "title": "Source Reference",
          "type": "string"
        }
      },
      "required": [
        "receipt_id",
        "replenishment_order_id",
        "product_id",
        "supplier_id",
        "stock_location_id",
        "received_quantity",
        "unit_of_measure",
        "received_at",
        "ingested_at",
        "available_at",
        "sequence",
        "source_reference"
      ],
      "title": "ReplenishmentReceipt",
      "type": "object"
    },
    "StockLocation": {
      "additionalProperties": false,
      "properties": {
        "id": {
          "pattern": "^[0-9a-f]{8}-[0-9a-f]{4}-[0-9a-f]{4}-[0-9a-f]{4}-[0-9a-f]{12}$",
          "title": "Id",
          "type": "string"
        },
        "location_code": {
          "minLength": 1,
          "pattern": "\\S",
          "title": "Location Code",
          "type": "string"
        }
      },
      "required": [
        "id",
        "location_code"
      ],
      "title": "StockLocation",
      "type": "object"
    },
    "Supplier": {
      "additionalProperties": false,
      "properties": {
        "supplier_id": {
          "pattern": "^[0-9a-f]{8}-[0-9a-f]{4}-[0-9a-f]{4}-[0-9a-f]{4}-[0-9a-f]{12}$",
          "title": "Supplier Id",
          "type": "string"
        },
        "supplier_code": {
          "pattern": "^[A-Z0-9][A-Z0-9_-]*$",
          "title": "Supplier Code",
          "type": "string"
        },
        "country_code": {
          "enum": [
            "PL",
            "DE"
          ],
          "title": "Country Code",
          "type": "string"
        },
        "status": {
          "enum": [
            "active",
            "inactive"
          ],
          "title": "Status",
          "type": "string"
        },
        "minimum_order_quantity": {
          "exclusiveMinimum": 0,
          "title": "Minimum Order Quantity",
          "type": "integer"
        },
        "available_at": {
          "pattern": "^\\d{4}-\\d{2}-\\d{2}T\\d{2}:\\d{2}:\\d{2}(?:\\.\\d{1,6})?(?:Z|\\+00:00)$",
          "title": "Available At",
          "type": "string"
        }
      },
      "required": [
        "supplier_id",
        "supplier_code",
        "country_code",
        "status",
        "minimum_order_quantity",
        "available_at"
      ],
      "title": "Supplier",
      "type": "object"
    }
  },
  "additionalProperties": false,
  "properties": {
    "contract_version": {
      "const": "replenishment-1.0.0",
      "title": "Contract Version",
      "type": "string"
    },
    "over_receipt_policy": {
      "const": "reject",
      "title": "Over Receipt Policy",
      "type": "string"
    },
    "products": {
      "items": {
        "$ref": "#/$defs/Product"
      },
      "minItems": 1,
      "title": "Products",
      "type": "array"
    },
    "stock_locations": {
      "items": {
        "$ref": "#/$defs/StockLocation"
      },
      "minItems": 1,
      "title": "Stock Locations",
      "type": "array"
    },
    "suppliers": {
      "items": {
        "$ref": "#/$defs/Supplier"
      },
      "minItems": 1,
      "title": "Suppliers",
      "type": "array"
    },
    "product_suppliers": {
      "items": {
        "$ref": "#/$defs/ProductSupplier"
      },
      "minItems": 1,
      "title": "Product Suppliers",
      "type": "array"
    },
    "replenishment_orders": {
      "items": {
        "$ref": "#/$defs/ReplenishmentOrder"
      },
      "title": "Replenishment Orders",
      "type": "array"
    },
    "delivery_plan_versions": {
      "items": {
        "$ref": "#/$defs/DeliveryPlanVersion"
      },
      "title": "Delivery Plan Versions",
      "type": "array"
    },
    "replenishment_receipts": {
      "items": {
        "$ref": "#/$defs/ReplenishmentReceipt"
      },
      "title": "Replenishment Receipts",
      "type": "array"
    }
  },
  "required": [
    "contract_version",
    "over_receipt_policy",
    "products",
    "stock_locations",
    "suppliers",
    "product_suppliers",
    "replenishment_orders",
    "delivery_plan_versions",
    "replenishment_receipts"
  ],
  "title": "ReplenishmentPayload",
  "type": "object"
}
